{
  "id": "chase-sapphire-preferred",
  "name": "Chase Sapphire Preferred",
  "issuer": "Chase",
  "identity": {
    "isStudentCard": false,
    "isBusinessCard": false,
    "starterFriendly": false
  },
  "costs": {
    "annualFee": 95,
    "aprPurchase": {
      "min": 21.49,
      "max": 28.49
    },
    "foreignTransactionFee": 0
  },
  "rewards": {
    "baseRate": 0.01,
    "categoryRates": {
      "dining": 0.03,
      "groceries": 0.01,
      "gas": 0.01,
      "travel": 0.03,
      "transit": 0.01,
      "drugstores": 0.01,
      "streaming": 0.01,
      "onlineShopping": 0.01,
      "entertainment": 0.01,
      "homeImprovement": 0.01,
      "utilities": 0.01,
      "other": 0.01
    },
    "caps": {},
    "rotatingCategories": {
      "enabled": false
    },
    "signUpBonus": {
      "amount": 600,
      "spendRequired": 4000,
      "monthsToComplete": 3,
      "description": "60,000 bonus points after you spend $4,000 on purchases in the first 3 months from account opening (worth $600 when redeemed through Chase Ultimate Rewards)"
    }
  },
  "travelPerks": {
    "noForeignTxFee": true,
    "tripDelayCoverage": true,
    "baggageDelayCoverage": true,
    "lostLuggageCoverage": true,
    "rentalCarCDW": true,
    "loungeAccess": false,
    "travelPortalBonus": true,
    "travelInsurance": true,
    "tsaPrecheckCredit": 0,
    "annualTravelCredit": 0,
    "concierge": false,
    "transferPartners": true
  },
  "businessFeatures": {
    "employeeCards": false,
    "employeeCardFee": 0,
    "expenseTools": false,
    "yearEndSummary": false,
    "vendorPayments": false
  },
  "eligibility": {
    "minAge": 18,
    "creditScoreMin": 690,
    "requiresIncome": true,
    "requiresCosignerUnder21": false
  },
  "trust": {
    "lastVerifiedDate": "2025-01-09",
    "sourceUrl": "https://www.chase.com/personal/credit-cards/sapphire/sapphire-preferred",
    "termsUrl": "https://creditcards.chase.com/rewards-credit-cards/sapphire/preferred/terms",
    "dataSource": "issuer_website"
  },
  "description": "Premium travel rewards card with dining and travel bonuses, transfer partners, and travel insurance",
  "highlights": [
    "3x points on dining and travel",
    "60,000 bonus points after $4,000 spend",
    "1.25x value when redeeming through Chase portal",
    "No foreign transaction fees",
    "Travel and rental car insurance included",
    "Points transfer to 14+ airline and hotel partners"
  ]
}

